{
  "$schema": "https://json-schema.org/draft/2020-12/schema",
  "$id": "https://hld-with-ui.dev/schemas/workshop.schema.json",
  "title": "Versioned design workshop",
  "type": "object",
  "additionalProperties": false,
  "required": [
    "schemaVersion",
    "id",
    "contentVersion",
    "introduction",
    "invariant",
    "stages"
  ],
  "properties": {
    "schemaVersion": {
      "type": "integer",
      "const": 1
    },
    "id": {
      "type": "string",
      "pattern": "^[a-z0-9]+(?:-[a-z0-9]+)*$",
      "maxLength": 100
    },
    "contentVersion": {
      "type": "string",
      "pattern": "^[0-9]+\\.[0-9]+\\.[0-9]+$",
      "maxLength": 32
    },
    "introduction": {
      "type": "string",
      "minLength": 1,
      "maxLength": 10000
    },
    "invariant": {
      "type": "string",
      "minLength": 1,
      "maxLength": 10000
    },
    "stages": {
      "type": "array",
      "minItems": 1,
      "maxItems": 20,
      "items": {
        "$ref": "#/$defs/WorkshopStage"
      }
    }
  },
  "$defs": {
    "RubricCriterion": {
      "type": "object",
      "additionalProperties": false,
      "required": ["id", "prompt"],
      "properties": {
        "id": {
          "type": "string",
          "pattern": "^[a-z0-9]+(?:-[a-z0-9]+)*$",
          "maxLength": 100
        },
        "prompt": {
          "type": "string",
          "minLength": 1,
          "maxLength": 2000
        }
      }
    },
    "ExperimentLink": {
      "type": "object",
      "additionalProperties": false,
      "required": ["topicId", "label", "instruction"],
      "properties": {
        "topicId": {
          "type": "string",
          "pattern": "^[a-z0-9]+(?:-[a-z0-9]+)*$",
          "maxLength": 100
        },
        "label": {
          "type": "string",
          "minLength": 1,
          "maxLength": 200
        },
        "instruction": {
          "type": "string",
          "minLength": 1,
          "maxLength": 2000
        }
      }
    },
    "WorkshopStage": {
      "type": "object",
      "additionalProperties": false,
      "required": [
        "id",
        "title",
        "prompt",
        "reference",
        "rubric",
        "experimentLinks",
        "sourceIds"
      ],
      "properties": {
        "id": {
          "type": "string",
          "pattern": "^[a-z0-9]+(?:-[a-z0-9]+)*$",
          "maxLength": 100
        },
        "title": {
          "type": "string",
          "minLength": 1,
          "maxLength": 200
        },
        "prompt": {
          "type": "string",
          "minLength": 1,
          "maxLength": 10000
        },
        "reference": {
          "type": "string",
          "minLength": 1,
          "maxLength": 10000
        },
        "rubric": {
          "type": "array",
          "minItems": 1,
          "maxItems": 20,
          "items": {
            "$ref": "#/$defs/RubricCriterion"
          }
        },
        "experimentLinks": {
          "type": "array",
          "minItems": 0,
          "maxItems": 10,
          "items": {
            "$ref": "#/$defs/ExperimentLink"
          }
        },
        "sourceIds": {
          "type": "array",
          "minItems": 1,
          "maxItems": 20,
          "items": {
            "type": "string",
            "pattern": "^[a-z0-9]+(?:-[a-z0-9]+)*$",
            "maxLength": 100
          },
          "uniqueItems": true
        }
      }
    }
  }
}
